{
  "schemaVersion": 2,
  "enabled": true,
  "updatedAt": "2026-09-22T00:00:00Z",
  "supportedMarkets": ["spain", "france", "germany", "united_states", "united_kingdom", "italy"],
  "products": {
    "kit_semipermanente_jodsone_36_piezas": {
      "displayName": "Kit de manicura semipermanente de 36 piezas",
      "brand": "JODSONE",
      "category": "kits_iniciacion",
      "description": "Kit para principiantes con lámpara, 32 colores, base y acabados brillante y mate.",
      "offers": {
        "spain": [{ "retailer": "Amazon España", "url": "https://www.amazon.es/dp/B0FJS1PQ2K?tag=paulaymanu113-21", "enabled": true, "priority": 100 }],
        "france": [{ "retailer": "Amazon France", "url": "https://www.amazon.fr/s?k=JODSONE+gel+nail+kit+36+pieces&tag=paulaymanu105-21", "enabled": true, "priority": 100 }],
        "germany": [{ "retailer": "Amazon Deutschland", "url": "https://www.amazon.de/s?k=JODSONE+gel+nail+kit+36+pieces&tag=paulaymanu102-21", "enabled": true, "priority": 100 }],
        "united_states": [{ "retailer": "Amazon United States", "url": "https://www.amazon.com/s?k=JODSONE+gel+nail+kit+36+pieces&tag=paulaymanu-20", "enabled": true, "priority": 100 }],
        "united_kingdom": [{ "retailer": "Amazon United Kingdom", "url": "https://www.amazon.co.uk/s?k=JODSONE+gel+nail+kit+36+pieces&tag=paulaymanu100-21", "enabled": true, "priority": 100 }],
        "italy": [{ "retailer": "Amazon Italia", "url": "https://www.amazon.it/s?k=JODSONE+gel+nail+kit+36+pieces&tag=paulaymanu10d-21", "enabled": true, "priority": 100 }]
      }
    },
    "lampara_uv_led_sunuv": {
      "displayName": "Lámpara profesional UV/LED con cuatro temporizadores",
      "brand": "SUNUV",
      "category": "lamparas_uv_led",
      "description": "Lámpara para curado de gel con modos de 10, 30, 60 y 90 segundos.",
      "offers": {
        "spain": [{ "retailer": "Amazon España", "url": "https://www.amazon.es/dp/B08KS4W6L6?tag=paulaymanu113-21", "enabled": true, "priority": 100 }],
        "france": [{ "retailer": "Amazon France", "url": "https://www.amazon.fr/s?k=SUNUV+UV+LED+nail+lamp+4+timers&tag=paulaymanu105-21", "enabled": true, "priority": 100 }],
        "germany": [{ "retailer": "Amazon Deutschland", "url": "https://www.amazon.de/s?k=SUNUV+UV+LED+nail+lamp+4+timers&tag=paulaymanu102-21", "enabled": true, "priority": 100 }],
        "united_states": [{ "retailer": "Amazon United States", "url": "https://www.amazon.com/s?k=SUNUV+UV+LED+nail+lamp+4+timers&tag=paulaymanu-20", "enabled": true, "priority": 100 }],
        "united_kingdom": [{ "retailer": "Amazon United Kingdom", "url": "https://www.amazon.co.uk/s?k=SUNUV+UV+LED+nail+lamp+4+timers&tag=paulaymanu100-21", "enabled": true, "priority": 100 }],
        "italy": [{ "retailer": "Amazon Italia", "url": "https://www.amazon.it/s?k=SUNUV+UV+LED+nail+lamp+4+timers&tag=paulaymanu10d-21", "enabled": true, "priority": 100 }]
      }
    },
    "torno_unas_xoali": {
      "displayName": "Torno para uñas 12 en 1",
      "brand": "Xoali",
      "category": "tornos_y_limas",
      "description": "Torno USB de velocidad ajustable con brocas para manicura y pedicura.",
      "offers": {
        "spain": [{ "retailer": "Amazon España", "url": "https://www.amazon.es/dp/B0B3Y81RN2?tag=paulaymanu113-21", "enabled": true, "priority": 100 }],
        "france": [{ "retailer": "Amazon France", "url": "https://www.amazon.fr/s?k=nail+drill+12+in+1+manicure&tag=paulaymanu105-21", "enabled": true, "priority": 100 }],
        "germany": [{ "retailer": "Amazon Deutschland", "url": "https://www.amazon.de/s?k=nail+drill+12+in+1+manicure&tag=paulaymanu102-21", "enabled": true, "priority": 100 }],
        "united_states": [{ "retailer": "Amazon United States", "url": "https://www.amazon.com/s?k=nail+drill+12+in+1+manicure&tag=paulaymanu-20", "enabled": true, "priority": 100 }],
        "united_kingdom": [{ "retailer": "Amazon United Kingdom", "url": "https://www.amazon.co.uk/s?k=nail+drill+12+in+1+manicure&tag=paulaymanu100-21", "enabled": true, "priority": 100 }],
        "italy": [{ "retailer": "Amazon Italia", "url": "https://www.amazon.it/s?k=nail+drill+12+in+1+manicure&tag=paulaymanu10d-21", "enabled": true, "priority": 100 }]
      }
    },
    "kit_cuticulas_makartt": {
      "displayName": "Kit profesional para cutículas",
      "brand": "Makartt",
      "category": "preparacion",
      "description": "Juego de acero inoxidable con alicate, empujador de doble extremo y raspador.",
      "offers": {
        "spain": [{ "retailer": "Amazon España", "url": "https://www.amazon.es/dp/B0BK7Z259G?tag=paulaymanu113-21", "enabled": true, "priority": 100 }],
        "france": [{ "retailer": "Amazon France", "url": "https://www.amazon.fr/s?k=Makartt+cuticle+kit+nipper+pusher&tag=paulaymanu105-21", "enabled": true, "priority": 100 }],
        "germany": [{ "retailer": "Amazon Deutschland", "url": "https://www.amazon.de/s?k=Makartt+cuticle+kit+nipper+pusher&tag=paulaymanu102-21", "enabled": true, "priority": 100 }],
        "united_states": [{ "retailer": "Amazon United States", "url": "https://www.amazon.com/s?k=Makartt+cuticle+kit+nipper+pusher&tag=paulaymanu-20", "enabled": true, "priority": 100 }],
        "united_kingdom": [{ "retailer": "Amazon United Kingdom", "url": "https://www.amazon.co.uk/s?k=Makartt+cuticle+kit+nipper+pusher&tag=paulaymanu100-21", "enabled": true, "priority": 100 }],
        "italy": [{ "retailer": "Amazon Italia", "url": "https://www.amazon.it/s?k=Makartt+cuticle+kit+nipper+pusher&tag=paulaymanu10d-21", "enabled": true, "priority": 100 }]
      }
    },
    "set_limas_multigrano": {
      "displayName": "Set de limas y bloques de pulido multigrano",
      "category": "tornos_y_limas",
      "description": "Seis limas de doble cara con granos desde 100 hasta 4000 para preparación y acabado.",
      "offers": {
        "spain": [{ "retailer": "Amazon España", "url": "https://www.amazon.es/dp/B086S52X9Y?tag=paulaymanu113-21", "enabled": true, "priority": 100 }],
        "france": [{ "retailer": "Amazon France", "url": "https://www.amazon.fr/s?k=nail+files+buffer+set+100+180+240+4000&tag=paulaymanu105-21", "enabled": true, "priority": 100 }],
        "germany": [{ "retailer": "Amazon Deutschland", "url": "https://www.amazon.de/s?k=nail+files+buffer+set+100+180+240+4000&tag=paulaymanu102-21", "enabled": true, "priority": 100 }],
        "united_states": [{ "retailer": "Amazon United States", "url": "https://www.amazon.com/s?k=nail+files+buffer+set+100+180+240+4000&tag=paulaymanu-20", "enabled": true, "priority": 100 }],
        "united_kingdom": [{ "retailer": "Amazon United Kingdom", "url": "https://www.amazon.co.uk/s?k=nail+files+buffer+set+100+180+240+4000&tag=paulaymanu100-21", "enabled": true, "priority": 100 }],
        "italy": [{ "retailer": "Amazon Italia", "url": "https://www.amazon.it/s?k=nail+files+buffer+set+100+180+240+4000&tag=paulaymanu10d-21", "enabled": true, "priority": 100 }]
      }
    },
    "pinceles_nail_art_sularpek": {
      "displayName": "Set de pinceles de doble punta para nail art",
      "brand": "Sularpek",
      "category": "nail_art",
      "description": "Cinco herramientas de doble punta para líneas, detalles, pintura y punteado.",
      "offers": {
        "spain": [{ "retailer": "Amazon España", "url": "https://www.amazon.es/dp/B09Z2C2J5M?tag=paulaymanu113-21", "enabled": true, "priority": 100 }],
        "france": [{ "retailer": "Amazon France", "url": "https://www.amazon.fr/s?k=Sularpek+nail+art+brushes+dotting+tools&tag=paulaymanu105-21", "enabled": true, "priority": 100 }],
        "germany": [{ "retailer": "Amazon Deutschland", "url": "https://www.amazon.de/s?k=Sularpek+nail+art+brushes+dotting+tools&tag=paulaymanu102-21", "enabled": true, "priority": 100 }],
        "united_states": [{ "retailer": "Amazon United States", "url": "https://www.amazon.com/s?k=Sularpek+nail+art+brushes+dotting+tools&tag=paulaymanu-20", "enabled": true, "priority": 100 }],
        "united_kingdom": [{ "retailer": "Amazon United Kingdom", "url": "https://www.amazon.co.uk/s?k=Sularpek+nail+art+brushes+dotting+tools&tag=paulaymanu100-21", "enabled": true, "priority": 100 }],
        "italy": [{ "retailer": "Amazon Italia", "url": "https://www.amazon.it/s?k=Sularpek+nail+art+brushes+dotting+tools&tag=paulaymanu10d-21", "enabled": true, "priority": 100 }]
      }
    },
    "tips_almendra_diboniur": {
      "displayName": "Tips transparentes de almendra, 550 piezas",
      "brand": "Diboniur",
      "category": "tips_y_extensiones",
      "description": "Tips full cover en 11 tamaños para personalizar diseños o realizar extensiones.",
      "offers": {
        "spain": [{ "retailer": "Amazon España", "url": "https://www.amazon.es/dp/B0CP3HVK5T?tag=paulaymanu113-21", "enabled": true, "priority": 100 }],
        "france": [{ "retailer": "Amazon France", "url": "https://www.amazon.fr/s?k=almond+full+cover+nail+tips+550&tag=paulaymanu105-21", "enabled": true, "priority": 100 }],
        "germany": [{ "retailer": "Amazon Deutschland", "url": "https://www.amazon.de/s?k=almond+full+cover+nail+tips+550&tag=paulaymanu102-21", "enabled": true, "priority": 100 }],
        "united_states": [{ "retailer": "Amazon United States", "url": "https://www.amazon.com/s?k=almond+full+cover+nail+tips+550&tag=paulaymanu-20", "enabled": true, "priority": 100 }],
        "united_kingdom": [{ "retailer": "Amazon United Kingdom", "url": "https://www.amazon.co.uk/s?k=almond+full+cover+nail+tips+550&tag=paulaymanu100-21", "enabled": true, "priority": 100 }],
        "italy": [{ "retailer": "Amazon Italia", "url": "https://www.amazon.it/s?k=almond+full+cover+nail+tips+550&tag=paulaymanu10d-21", "enabled": true, "priority": 100 }]
      }
    },
    "pegatinas_flores_jmeowio": {
      "displayName": "Pegatinas 3D de flores para uñas",
      "brand": "JMEOWIO",
      "category": "decoracion",